<?xml version="1.0" encoding="windows-1251"?>
<TICKET xmlns:xsi="http://www.w3.org/2001/XMLSchema-instance" xsi:noNamespaceSchemaLocation="ticket01.xsd">
	<!--Унікальний ідентифікатор документа (GUID, обов’язковий)-->
	<UID>F32EE0EF-F8EE-46BD-9943-881AF3F982F5</UID>
	<!--Дата операції (ddmmyyyy, обов’язковий)-->
	<ORDERDATE>18112015</ORDERDATE>
	<!--Час операції (hhmmss, обов’язковий)-->
	<ORDERTIME>201543</ORDERTIME>
	<!--Локальний номер документа (128 символів, обов’язковий)-->
	<ORDERNUM>12345678</ORDERNUM>
	<!--Фіскальний номер документа (128 символів, необов’язковий)-->
	<ORDERTAXNUM>101234567890123</ORDERTAXNUM>
	<!--Ідентифікатор офлайн сесії (128 символів, обов’язковий)-->
	<OFFLINESESSIONID>2378946</OFFLINESESSIONID>
	<!--"Секретне число" для обчислення фіскального номера офлайн документа (128 символів, обов’язковий)-->
	<OFFLINESEED>293573240985</OFFLINESEED>
	<!--Код помилки (Ціле число >= 0, обов’язковий)-->
	<ERRORCODE>1</ERRORCODE>
	<!--Текст помилки (Текст, обов’язковий)-->
	<ERRORTEXT>РРО з фіскальним номером 123 не зареєстрований</ERRORTEXT>
	<!--Версія формату документа (числовий)-->
	<VER>1</VER>
</TICKET>